title,date,cotent
你叫“一点不紧张女士”吗？,2024年12月13日 13:29,你叫一点不紧张女士吗？别特么瞎念，那叫一点不紧张，女士   那不一样吗？哪一样啊，嘚呵的   为什么生气了？我想网：因为让你念松了...
56个民族，已增至66个了,2024年12月12日 13:55,56个民族，现如今，已经增至66个了如下：57，上班族，58，月光族，59，还贷族，60，成事不族，61，余额不族，62，啃老族，63，气血不族，64，脑供血不族，65，扁平族，66，加班族，我们又多了10个民族。再过几年   ...
35岁+才能想明白的8件事儿，特别的实在,2024年12月10日 16:26,1、家庭的第一核心真的不是感情，而是经济。不管你是否承认，事实上，一个家庭里绝大多数的问题都跟钱有关。养育孩子需要钱，生活品质需要钱，孝敬父母需要钱，谈情说爱，更需要钱。金钱不是万能的，有些东西钱还   ...
一夫一妻：一个夫人，一个妻子？,2024年12月06日 18:11,"一夫一妻的意思是：正好一夫一妻，一个夫人，一个妻子，我想网：想的美。什么是一夫一妻？一夫一妻制（monogamy）亦称单偶婚、个体婚是文明世界的体现，一夫一妻制是一男一女结为夫妻的婚姻制度。也就是说,一个男   ..."
远离大龄剩女，年龄大是她最小的缺点。,2024年11月28日 16:31,来自一位网友@公羊: 远离大龄剩女，你如果不听劝，交往之后你会发现，年龄大是她最小的缺点。如今，怎么定义大龄剩女？现在这个社会，对大龄剩女的定义其实挺模糊的，也挺让人头疼的。以前可能一过了25岁还没结   ...
结婚证，是唯一不需要考试就能领的证！,2024年11月26日 15:47,"哈哈哈哈哈哈被这段吐槽当众求婚笑死了，真的是我的嘴替。。求婚是唯一一件下跪就能办成的事，同理，结婚证也是不需要考试就能领的证！ ​当众求婚就是一种当众绑架,跪了！还说应该用在老板身上，想涨工资就给老   ..."
摩托车三年强制报废，全世界唯一的荒唐,2024年11月22日 15:06,这摩托车三年强制报废，简直就是荒唐，全世界唯一的，为什么不能放开呢？那谁敢买摩托车？13年相当于汽车开三年的里程就报废了，你说汽车卖三年你就报废，干脆报废，你敢买汽车吗？各个城市都不接受二手车，二手   ...
肩膀的膀是膀胱的膀，开了眼界了,2024年11月22日 14:57,肩膀的膀是膀胱的膀，草率的率是效率的率，旺仔的仔是仔细的仔，茄子的茄是雪茄的茄，咖啡的咖是咖喱的咖，真是开了眼界了。...
让老百姓没积蓄，是全球的一个底层战术？,2024年11月20日 15:28,我在逛商场时，突然有一个感悟：一个城市，别管他名义上的工资有多高。那都是虚的。不管是伦敦、纽约、北京、上海、香港任何一个大城市，它的物价水平会自动调整到，让底层劳动者付完房租、吃喝、交通等基本的生   ...
2025年，将是20年来就业最难的一年！,2024年11月19日 13:14,时代真的变了，2025年将会是20年来就业最难的一年，1200万的大学生，100多万的硕博，几百万的中专技校还有大厂中小企业今年裁员裁了几百万，千万人在等待就业。还没有算灵活用工。中国刚送走了廉价的农民工，却迎   ...
刘备为什么会败，因为封了个“沛种王”,2024年11月13日 11:27,哈哈，来自三国演义里面的一个新段子话说，刘备为什么会败，他的文臣武将不兼容，所以才导致后期失败。我心中最佳配置：诸葛亮配赵云守成都，徐庶配关羽守荆州，庞统配张飞守汉中。我配大乔小乔和貂蝉张绣婶子，   ...
房子卖不动，降首付，让个子矮的人也能吊上去...,2024年10月30日 16:57,房子一卖不动，就降利率和首付，说到底就是把上吊的绳子往下放了放，让个子矮的人也能吊上去   ...
谢春芳是谁？云朵为什么单飞了？,2024年10月18日 13:36,谢春芳就是刀郎大徒弟云朵，原名谢春芳，羌族，1987年2月7日出生于四川省阿坝藏族羌族自治州茂县，中国内地女歌手，刀朗隐退后，云朵误以为他江郎才尽，便投靠了其他音乐人，这也无可厚非。未料，刀朗突然重返乐   ...
隧道第一次通车是何时？,2024年10月11日 15:24,1 隧道第一次通车是何时？2 开通后工程隧道多久通一次车？3 平时通车的时候有没涉水的情况？4 大雪封路7天可以从后面小路进吗5 机车不预热直接开有伤害吗？6 机车在高速行驶时，拔出钥匙，车载音乐会停止吗？7 隧   ...
抖音网友，8句生活日常批判“食品安品”,2024年10月11日 14:58,《我想网》整理了2024年10月最新搞笑段子，来自抖音网友，8句生活日常批判食品安品：1 早上起来喝一杯没有黄豆的勾兑的豆浆2 吃两个淋巴肉做的包子3 中午吃一份僵尸肉做的外卖4 下午饿了喝一杯科技与狠活的奶茶5    ...
乞丐网-有钱人，再也不用线下打赏乞丐了,2024年10月09日 14:32,今天发现一站长的想法很有意思他说要不要创建一个乞丐网（每日领低保）行善积德的那种，《我想网》个人觉得，套路还可以，就看有没有人愿意出钱了，想法如下：有钱人在上门发帖子，或者求祝福求平安或者发广告。   ...
老师是专门训练过的，“抗疯”能力强,2024年09月30日 15:09,你知道我们为什么要开学了吗?因为再不开学家长就要疯了，那为什么开学4个月又要放假呢，因为再不放假，老师就疯了，所以开学——放假——开学——放假   那为什么开学时间长，放假时间短呢？那是因为，老师是专门   ...
为什么高铁上很安静，火车上却是叽叽喳喳？,2024年09月27日 10:57,为什么高铁上，每个人都很安静，火车上却是叽叽喳喳，因为高铁坐的是儿女，火车坐的是父母，高铁是理想，火车是归途，高铁是中国的速度，火车是中国温度，高铁很快，快的到你记不清邻坐人的样子。火车很慢，慢到   ...
二胡为什么听起来伤感？两根弦的原因,2024年09月13日 09:25,有人问，二胡为什么听起来那么伤感，因为二胡只有两根弦，相依为命，日夜相对，却不能相拥笛子一响：江山没了。马头琴一响：爱情没了。吉他一响：青春没了。古筝一响：江湖没了。唢呐一响：人没了。二胡一响：心   ...
2025搞笑绕口令：鸡大梨大篱笆大,2024年09月02日 16:45,鸡大梨大篱笆大鸡大梨大篱笆大，大鸡大梨大篱笆鸡比梨大篱笆比鸡大，鸡大梨大篱笆大。大鸡大梨大篱笆，鸡比梨大篱笆比鸡大。鸡大梨大篱笆大，大鸡大梨大篱笆，鸡比梨大篱笆比鸡大。...
微信太敏感了，有人举报就限流,2024年08月08日 16:24,想友必看：好久不见，想友们！近日，被闲人恶意举报，然后限流了7天，导致你们无法点赞、评论、收藏和转发，本来大家聚一起，聊聊天，玩玩段子，唠会嗑，结果微信给你扣一个营销过度和低俗的帽子，然后限流，说真   ...
2024年影视网站不能做，蹲了一年，分享下心得,2024年07月29日 13:53,2024年影视网站不能做，蹲了一年，分享下心得首先声明，进去蹲了一年的原因，是因为搞影视站，站群，引流app搞付费充值，盈利34w，全部被没收，罚款2w元，干了几个月的影视站，赔了时间，赔了钱，早知道就听我朋   ...
再回首吴昕，伊玖，只有那武静和常璐伴着我...,2024年07月18日 16:38,再回首，歌词改编：曾经在：悠悠，安安，帆帆，芙美中追雯雯，才知道萍萍，丹丹，聪聪，蓉蓉才是真，再回首黄冉，如梦，再回首吴昕，伊玖，只有那武静和常璐伴着我   ...
孙悟空生平仅有一次被骗：牛魔王变八戒,2024年07月05日 09:16,什么是真兄弟?孙悟空生平仅有一次被骗：牛魔王变八戒。悟空被困金钵:八戒动用了所有人脉资源。唐僧从来都不会赶走八戒:因为八戒真走。八戒与悟空之间再打再闹，可是当悟空的眼睛被黄风怪迷瞎之后，是八戒陪在身边   ...
小姑娘嘲笑道：男生如打火机，一点就着，一吹就灭！,2024年07月02日 11:27,每日一问：男生如打火机？昨天，一小姑娘嘲笑的说道：男生如打火机，一点就着，一吹就灭！在线求救：如果是你，该怎么反驳她？第一种反驳：你给我吹一个试试！第二种反驳：女生如炮仗，一点就着，一吹就胖！第三   ...
坐着尿尿和生孩子，男人选哪个？,2024年07月01日 14:50,男人题：坐着尿尿和生孩子，必选一个？有人说，站着尿尿是男人最后的尊严，也有人说，坐着尿尿是男人绅士的表现，如果有一天，你只有两个选择：坐着尿尿和生孩子，你会选哪个？反问：兄弟们你们拉屎的时候，非得   ...
建议父亲节改为母亲节的后一天，最起码还能吃前一天的剩菜！,2024年06月17日 15:44,2024年父亲节最痛心的一句话：建议父亲节改为母亲节的后一天，最起码还能吃前一天的剩菜！奉劝大家两句、老公只要不嫖，不赌，不家暴，还会偶尔做饭做做家务，挣点钱够用就行，不要相信网上的毒鸡汤，什么过节就   ...
谁悲单身之狗，萍水相逢，尽是他人之妻！,2024年06月04日 16:14,我，三尺微命，一介布衣，无人敢爱，等终白发之年老，慕年少之爱恨。嗟乎，情关难越，谁悲单身之狗，萍水相逢，尽是他人之妻！...
2024年那些”有大病“却说的很对的句子！,2024年05月31日 15:40,1、自从疯了以后，感觉事情好办多了。2、纯爱已经满足不了我了，纯金可以。3、与其逼自己一把，不如放自己一马。4、优秀的人，连罩杯都是A的。5、二选一的选择题都赌不对，就敢在14亿人里面赌男人。6、处对象吗？   ...
2024年还敢往外借钱的人，要么多个敌人，要么多个哥们儿！,2024年05月16日 10:57,2024年还敢往外借钱的人，要么多个敌人，要么多个哥们儿！如今借出去的钱，多数都被当做喂狗了，为什么呢？很多人一开始不信这个歪理，特地去验证了 ，到头了发现自己还是太年轻了，通过借呗、微信等平台借钱给   ...
穷人诗——庙练练，一个被生活耽误了的诗人（图）,2024年04月23日 13:18,（穷人诗）初来人间不知苦；潦草半生一身无；转身回望来时路；才知生时为何哭。——庙练练一个被生活耽误了的诗人...
多巴胺控制感情，考研控制矫情——愚人节快乐！,2024年04月01日 14:31,《我想网》整理了15个关于2024年在职考研人的愚人节搞笑段子套路情话文案，多巴胺控制感情，考研控制矫情——愚人节快乐！1、你为什么去北京考研？因为我喜欢北京烤鸭！2、英雄不问出处，考研不问初恋。3、我怎么   ...
抖音:记录你的变态生活！,2024年03月28日 12:35,记录你的变态生活抖音的solgan是 记录你的美好生活，应该改成记录你的变态生活，你拍个普普通通的日常是没流量的，你必须变态，必须反差，那才有流量，别人用牙刷刷牙，你就用手刷，别人在家看书，你跑到猪圈去   ...
人一辈子要会一种乐器，像我退堂鼓打的就不错,2024年03月27日 09:08,2024年3月27日最新段子：我觉得人一辈子一定要会一种乐器，像我退堂鼓打的就不错，这都不算什么，我吹拉弹唱样样精通，吹牛皮、拉家常、弹烟灰、唱反调   ...
张韶涵的梗段子：爸爸你骗人，这明明是妈妈,2024年03月19日 10:21,多年以后，我拿出张韶涵的照片对儿子说这是爸爸当年的女神。结果儿子直接对我说爸爸你骗人，这明明是妈妈。我转身和正在厨房做饭的张韶涵相视一笑！...
我自愿签订出门在外互帮父母条约（年轻人扎心文案）,2024年03月15日 10:58,这句话（我自愿签订出门在外互帮父母条约），扎了多少年轻人的心，3月13日，山东威海，女生赶高铁看到腿脚不便独自出行的大叔，主动帮忙把行李搬上了阶梯。网友随后问道，下个路口怎么办？下个路口有千千万万个我   ...
