用户名,评论日期,车型款式,评星,裸车价,油耗,购车时间,评价内容
裙de女孩,2021-01-31,奥迪A6L 2020款 40 TFSI 豪华动感版,4.43,35.98,8.9L/100km,2020-07,在看A6之前，跟朋友去车展逛直接定了QX50，其实这车也还不错，四驱，270匹，符合我的需求，后来跟朋友们一起吃饭，都建议我这个预算肯定上BBA，于是第二天就去退定金，还白白损失了2000块钱；然后就决定去买Q5，看中天云灰，价格都谈好了，后来被告知谈好的价格不卖了，临时涨价，可能因为这个颜色比较稀少不愁卖。接着销售建议直接上A6，看了内饰比较吸引我，这样马上谈了价格就定了A6，现在想想还是买到了最值得买的车。
撩友缇式秭案,2021-01-27,奥迪A6L 2020款 45 TFSI 臻选动感版,5.00,43.5,8L/100km,2020-12,经济实惠，养车方面也不会有太大的经济压力，而且车的空间也足够日常使用，整体来说，这款车很值这个价格的。
屿卿杀手,2021-01-25,奥迪A6L 2020款 40 TFSI 豪华动感版,4.71,35.98,8.9L/100km,2020-05,当时优惠幅度比较大，性价比满大的，然后奥迪a6l是一个比较均衡的车型。
居心演员,2021-01-24,奥迪A6L 2020款 45 TFSI quattro 尊享动感版,4.57,45.68,10.4L/100km,2020-09,我一直就想买A6L了，现在经济预算方面比较宽裕了，果断就换了A6L。A6L的性价比蛮好的，入手的我觉得还是很划算的。
雪月花月,2021-01-23,奥迪A6L 2020款 45 TFSI 臻选动感版,4.71,36.96,9.5L/100km,2020-07,最开始一直在易车关注Q5L，后来去试驾整体很失望尤其内饰Q3都比他好太多果断放弃，宝马没好感，舅老爷前段时间买了开过几天坐姿和视线不如A6开着轻松。
信人19號收,2021-01-23,奥迪A6L 2021款 45 TFSI 臻选动感型,4.86,37.78,8.6L/100km,2020-12,上个车是宝马老款5系，不想在宝马了，然后奔驰e也考虑过，不过喷子多怕真的质量不行，而且e中期改款有点丑，所以试试奥迪。
婶今儿个寄,2021-01-23,奥迪A6L 2020款 55 TFSI quattro 旗舰动感版,4.86,54.63,11.9L/100km,2020-06,"其实从去年底开始, 我就已经把换车提上了日程,当时试驾了: A7 ( 2019款3.0t)、A6L( 45tfsi)、5系(525)、Q5L、GLC300、 X3、 XT6, 有人肯定问咋没有E300L ,因为我第一个pass掉的就是E300L, 之前长途开过,座椅真的不舒服总感觉坐上去是歪的(也有可能是我的屁股歪,我可不是奔驰的黑子哦) , 而且开过C8这代A6L后再对比E300，最后还是选择了A6L的55旗舰动感"
提起罚薄姬,2021-01-22,奥迪A6L 2020款 40 TFSI 豪华致雅版,4.57,35.98,8.9L/100km,2020-10,我感觉我能够选择奥迪A6L原因很简单，就是因为价格好，很便宜，用起来也高大上。
失宠望,2021-01-21,奥迪A6L 2020款 40 TFSI 豪华动感版,4.86,35.98,11.3L/100km,2020-08,在BBA类型的车中，作为C类车的价格还是非常给力的，贵的买来改不起。
冰河林彬梦,2021-01-21,奥迪A6L 2020款 40 TFSI 豪华动感版,4.29,35.98,8.5L/100km,2020-07,一家三口，父亲开7系，我也会开车，就买一辆家用得车，父亲也挺喜欢奥迪这个品牌，当时看车，就看外观跟内饰动力配置啥的可以不用管，日常家用就够，所以当时就看内饰很外观所有配置都没看，直接买了。正常来说不适合我这个年龄开，不过接触的人都是比较成熟的，慢慢变得成熟商务起来，本来想买科迈罗，不过最后我还是不选择拉风，而是选择成熟稳重家用！
见面今晚与,2021-01-15,奥迪A6L 2020款 45 TFSI quattro 臻选动感版,4.43,41.98,9.8L/100km,2020-10,1，接待应酬 2，为了自驾，选了个四驱 3，性价比
金凌宝貝,2021-01-14,奥迪A6L 2020款 45 TFSI quattro 尊享致雅版,4.57,43.2,10.7L/100km,2020-07,刚好需要换一辆车，全家人都看了喜欢A6L，就买了。性价比还是蛮高的，配置也蛮高的，也蛮实用的。
老去真,2021-01-14,奥迪A6L 2020款 45 TFSI 臻选动感版,4.71,38.7,11.5L/100km,2020-04,空间足够大！外形足够吸引！动力足够诱惑！
祂教我忘記运,2021-01-13,奥迪A6L 2020款 40 TFSI 豪华致雅版,4.57,33.89,9.9L/100km,2020-07,我觉得A6L的各方面都比较优质，所以才选的。
无敌蚊香毡,2021-01-11,奥迪A6L 2020款 40 TFSI 豪华动感版,4.71,35.98,10.1L/100km,2020-07,第一肯定是品牌效应了，第二是空间，第三是经济方面。
缎袍阡陌,2021-01-08,奥迪A6L 2020款 40 TFSI 豪华致雅版,4.57,35.98,10.5L/100km,2020-10,价格合适，在我的能力范围，外观好看，我入手这个配置的性价比我觉得是很高的。
乏味瞌睡,2021-01-07,奥迪A6L 2021款 45 TFSI quattro 臻选致雅型,4.86,46.88,11.3L/100km,2020-11,bba当中，没敢选e和马，感觉e这两年口碑不怎么好，马还可以，就是超预算，a6是最喜欢的，价格没得说，而且低调还气场也足，相对同级别凯迪 林肯 捷豹来说总感觉要好一点，家里人也喜欢这个，所以就没啥好说的了，乘年轻，给自己点压力，盘它。
繁华复,2021-01-07,奥迪A6L 2021款 45 TFSI 臻选动感型,4.71,38.9,10.3L/100km,2020-12,家里之前也有10款的老A6除了烧点机油，其他毛病很少，方向轻，车门厚实，底盘沉稳，加上新款C8外观更加运动。
芳兰赋,2021-01-07,奥迪A6L 2021款 45 TFSI 臻选动感型,4.86,38.17,10.1L/100km,2020-12,奥迪是一直以来的梦想，也考虑过A4L顶配和Q5高配，后出于商务和家用的用途放弃了，其实也都是不错的选择，新一代的A6L外观真的很年轻，动力调校也很激进，是00后的我的不二之选，作为人生第一台车，A6L给我的感受真的是很不错的。
车手27511167QM,2021-01-05,奥迪A6L 2020款 40 TFSI 豪华致雅版,4.00,33.5,11L/100km,2020-01,我发现选择这款车改版后的消费者也是来自我们这些年轻人。经过一段时间的使用发现了他有着不错的品质，不光是耐看，用起来也是同样棒的。对于我来说它再合适不过了，如果可以给它形容词，我想一定是年轻时尚，有质感，实用性最高最为贴切 有人可能被他的智能安全配置所打动，有人可能被他的驾控品质所触动心弦，每一个部位每一个特点都会成为选择它的理由
喻咬涛拚劳磐,2021-01-04,奥迪A6L 2020款 40 TFSI 豪华致雅版,5.00,40.2,9L/100km,2020-11,说实话也正是结合了它的性价比才买了这辆车，又被它的外观和配置所吸引，我买的是黑色的，而且它那个辅助驾驶系统真的很贴心，我平时用车更方便了，辅助配置加上酷酷的外观，自己很喜欢，家人也都支持，于是就拿下了这款车。
天亦笑谂,2021-01-02,奥迪A6L 2020款 40 TFSI 豪华动感版,4.57,33.78,10.5L/100km,2020-07,外观好看，内饰大气，价格实惠，没有理由不选A6L。
地主你去,2020-12-31,奥迪A6L 2020款 40 TFSI 豪华动感版,5.00,40.5,7L/100km,2020-09,喜欢外观，之前一直看的X3，那天上午都已经和老婆定下来了，准备下午去宝马那付购车定金，中午时老婆突然建议去看看奥迪，感觉对X3还是将就的态度，那说去就去，一去就看到了展厅的现车，直接上头了，马上对这款车打探了解了一下午，谈好优惠居然当天就定了，也是服了我们自己。
飞舞冰城偎,2020-12-31,奥迪A6L 2020款 40 TFSI 豪华致雅版,4.86,34.2,10.3L/100km,2020-08,关于选择奥迪A6L的原因，我最终选择A6L我觉得外观占了一大部分原因，这个级别的车子我觉得其他啥东西都没有必要看了，就是看喜欢不喜欢外观，还有价格的问题。
不想解了,2020-12-30,奥迪A6L 2020款 40 TFSI 豪华致雅版,4.43,35.98,11.8L/100km,2020-07,我也有考虑过沃尔沃S90，我觉得虽然说沃尔沃的性价比更高，但真不如去买A6L，因为后期的用车成本更低，而且保值率也更高，尤其是这个品牌带来的用车感受，绝对是S90不能比的。
文中侠扔,2020-12-27,奥迪A6L 2021款 40 TFSI 豪华动感型,4.86,35.7,8.8L/100km,2020-11,家用，商用，都可以开 还能开出去装装笔。
我是小户馅,2020-12-23,奥迪A6L 2020款 45 TFSI quattro 尊享动感版,4.71,43.5,10.6L/100km,2020-06,对比了很多车的，但是一直就是觉得很喜欢A6L的车标和奥迪的品质。
ucncd,2020-12-20,奥迪A6L 2020款 45 TFSI 臻选动感版,5.00,43.5,8.6L/100km,2020-10,车子开了1754公里了，目前没有什么问题，开起来很安逸。在同级别中性价比是最高的，外观大气，内饰的设计很搭配。科技感很强，配置很高，安全更有保障！
天风海涛覆,2020-12-20,奥迪A6L 2021款 40 TFSI 豪华动感型,4.86,36.3,9.2L/100km,2020-12,我觉得选择奥迪A6L不需要什么理由啊，喜欢就好了。
xdbvm扰,2020-12-20,奥迪A6L 2021款 40 TFSI 豪华动感型,4.57,35.9,8.7L/100km,2020-12,dream car，奥迪梦，性价比相对5系和e级更高。
带电合地刀肺,2020-12-19,奥迪A6L 2020款 45 TFSI quattro 尊享动感版,4.29,42.1,9.5L/100km,2020-10,18岁了解车起就有个奥迪梦，最初被tt车型吸引，30岁成家立业了，考虑家庭事业最终选择了a6 45尊享动感这个配置。
vhsgb搅,2020-12-18,奥迪A6L 2021款 40 TFSI 豪华动感型,4.71,36.3,9.2L/100km,2020-11,大空间，高颜值，我觉得奥迪A6L就是我的菜，没有理由不买啊。
甄蔚闵薛索,2020-12-17,奥迪A6L 2020款 55 TFSI quattro 尊享致雅版,5.00,54.4,9L/100km,2020-10,机的力量很大，跑起来也不输轿跑，还有就是它的商务气息很让我满意，没有什么不喜欢的地方。
木可南兑,2020-12-17,奥迪A6L 2020款 40 TFSI 豪华动感版,4.57,34.83,11.1L/100km,2020-09,A6L的空间充足，外观好看，内饰精致，我觉得选择A6L就是这些个原因。
隗陆梁查艾,2020-12-17,奥迪A6L 2020款 40 TFSI 豪华动感版,5.00,40.2,9L/100km,2020-10,整车的性价比很高，无论是外观内饰方面都很不错，整车的档次感也有，品质也是不错的，整车的外观更是亮点，花这个价位，能买到功能这么齐全的车，我还是觉得性价比高，值得！
都市鄂人父,2020-12-17,奥迪A6L 2020款 45 TFSI quattro 臻选动感版,4.71,39.93,9.2L/100km,2020-08,低调，经济。奔驰宝马都是好车，各有优劣，看自己取舍。
离开香谆,2020-12-14,奥迪A6L 2020款 40 TFSI 豪华致雅版,4.86,34.78,9.5L/100km,2020-07,说到选择奥迪A6L的原因，我觉得原因就是外观大气，内饰好看，然后主要是价格在我的预算之内，完全没有超我的预算，甚至还有可以留一点私房钱，所以入手奥迪A6L也是必然啊，肯定的。
言之不预也,2020-12-11,奥迪A6L 2021款 45 TFSI 臻选致雅型,4.43,44.38,9.5L/100km,2020-11,当时直接就冲着奥迪A6L来了，其他品牌没有多考虑，因为我觉得这就是最适合我的一个呀，不管价格也好还是本身的品质等等各方面都做得比较优秀一些，一汽的装配工艺，包括车子的用料以及配置等等各方面都要好很多。
偶是马叉虫墓,2020-11-21,奥迪A6L 2020款 45 TFSI quattro 尊享动感版,4.71,43.58,11.5L/100km,2020-07,就是因为外观好看，内饰也好看，价格也合适，就买了。
梅敖于柏仇,2020-11-18,奥迪A6L 2021款 40 TFSI 豪华动感型,5.00,33.99,8.2L/100km,2020-09,内饰比较好看，而且操控感也比较强，驾驶体验比较好，试驾之后就决定买这辆车了
史璩next,2020-11-16,奥迪A6L 2020款 40 TFSI 豪华动感版,5.00,40.2,9L/100km,2020-05,本人于2020年购买了20款奥迪A6L 我觉得A6L的性价比在这个级别之中是很好的，不用加装，价格不贵，是属于豪华品牌里面性价比很高的。
党骆安闵怀,2020-11-16,奥迪A6L 2021款 45 TFSI quattro 尊享动感型,5.00,50.5,10L/100km,2020-06,本人于2020年购买了20款奥迪A6L 性价比还是查高的，我觉得现在这个优惠力度来讲的话还是很划算的，这个车的外观很好看的，外观方面我觉得算是没什么可以挑剔了的，我和我的家人都是非常的喜欢的，还有各方面的表现都很好
竺叶曹岑缪,2020-11-16,奥迪A6L 2020款 45 TFSI 臻选动感版,5.00,43.5,12L/100km,2020-06,本人于2020年购买了20款奥迪A6L 本来没想买车的，群里唠嘻，聊到车，朋友们太热情了，不买不行了，随便买个凑合，对车需求不大，上下班一公里~已经有辆车了，谈生意也不需要充排面，不过买了以后还是很香的
龙饶邴吕汪,2020-11-11,奥迪A6L 2020款 40 TFSI 豪华动感版,5.00,40.5,9L/100km,2020-05,买它主要是外观的原因，太霸气，太好看了。开出去做生意特别有面子。买来，总体还行，毕竟性价比很高。
虞左堵邱韩,2020-11-01,奥迪A6L 2020款 45 TFSI 臻选动感版,5.00,43.2,9L/100km,2020-06,我是2020年买的20款A6L 这款车属于在预算内性能最高的一款，车型也很美观，这款车型的性价比也很高，这款车的空间也很大，满载的情况也不会感到很拥挤，非常适合一家人出行。
悬崖勒怎么办,2020-10-15,奥迪A6L 2020款 40 TFSI 豪华致雅版,5.00,39.0,10.5L/100km,2020-07,"刚开始是定位A6L乞丐版的,也没什么好选的,中大型BBA就它性价比最高了( 最便宜),但又听说A6L的质量等一系列问题又犹豫了一段时间。那好吧,对比了 ES200更省钱、省心了，过年前问,落地要35万多, 2.0的乞丐版,加价2万, 还不是现车啊!所以,后来还是选A6L吧!"
賈軒7LCuD8,2020-10-01 1 条追评,奥迪A6L 2007款 2.4 CVT 尊贵型,5.00,52.0,9L/100km,2007-12,当时买这个车算是豪华的 无论外形和动力来说 没得挑
雍容华贵蜻蜓5099,2020-10-03,奥迪A6L 2020款 55 TFSI quattro 尊享致雅版,5.00,48.0,9.5L/100km,2020-07,一进车店的第一眼我就看到了A6虽然不是特别亮眼，但是越看越耐看，改款之后感觉车身加长了不少，颜值也提高了不少
啊远啊84,2020-07-16 1 条追评,奥迪A6L 2020款 40 TFSI 豪华动感版,5.00,33.8,8.9L/100km,2020-07,一开始是在s90 五系 A6之间考虑了好久，然后首先考虑了保值的情况没有买s90再后来给4s店打电话的时候宝马的服务态度直接就很让人反感了 因为我的年龄较小，当时奥迪没改款得时候是没有考虑a6的后来改款了一眼就惊艳到了然后因为某些原因拖到现在才买
世界那么大一起看,2020-07-20,奥迪A6L 2019款 45 TFSI 臻选动感版,5.00,43.3,11L/100km,2019-07,不愧是中国的官车，空间足够大，乘坐舒适，日常家用足够了，后排空间非常的给力性价比很高
小富LA44rp,2020-06-22,奥迪A6L 2016款 45 TFSI quattro 运动型,4.00,42.0,9L/100km,2016-05,家庭用车需要一台成熟稳重的车，宜商宜家又不想太商务所以选择3.0T
王洋8567,2019-08-24,奥迪A6L 2019款 45 TFSI quattro 臻选动感版,5.00,39.0,9L/100km,2019-07,对A6情有独钟 就去看了看奔驰E 感觉不是自己想要的 果断回来选A6 上一台车也是A6
杜卡迪迪迪,2019-08-10,奥迪A6L 2018款 30周年纪念版 TFSI 进取版,5.00,35.68,7.7L/100km,2018-06,看过本田冠道，其实我感觉挺好的，后排前排空间都无敌，无奈老婆看不上，说这是个本田再换还是本田，那就别换了。后来直接到奥迪4s店看车。试驾一下，感觉挺稳重的，方向盘灵活。主要看重外观，时尚大气很耐看。
热爱生活热爱音乐,2019-07-24,奥迪A6L 2018款 30周年纪念版 TFSI 进取版,4.00,35.0,9L/100km,2019-03,一直都很喜欢奥迪这个牌子，低调，内敛有品味，这就是我对它的评价.当时买车就觉得要买奥迪车，众多车型为什么要选择它呢，其实第一眼的感觉很重要，轿车个跑车结合的外表很吸引我，而且内饰的空间大，各种丰富的配置，用一句话来形容就是，高端大气上档次，低调奢华有内涵，
徐玉娟姐,2019-07-24,奥迪A6L 2019款 45 TFSI quattro 臻选动感版,5.00,44.0,,2019-06,配置：全景天窗、运动座椅、三个大屏幕、倒车影像、手机互联MMI、城市前部版安全系统、氛围灯、BO音响
小小碧燕,2019-06-25,奥迪A6L 2019款 45 TFSI quattro 臻选动感版,5.00,44.0,,2019-05,【分享我的爱车】 #最满意# 1、内饰：三块大屏幕的设计，真的很显豪华高档，类似A8的设计，并且屏幕上会有按键触摸反馈； 2、座椅：选择的是动感型，座椅是带翻毛皮的，我个人比较喜欢，更透气，更有运动气息，也不至于那么的压抑； 3、LED大灯，不得夸一夸奥迪做灯的的灯厂，前大灯和后尾灯相呼应，确实很犀利大气，辨识度高，照射面积广； 4、空间：C级轿车的空间还是完全够用的，后排乘坐也舒适 #不满意# 车门不太好关闭，经常有关不紧的情况，要很用力才行 #选车理由# 同级别车型来说，性价比还是不错的，这一款车型改款很成功，奥迪的品质一直都非常的认可，从做工
啊今天我考虑,2019-06-19,奥迪A6L 2019款 45 TFSI 臻选致雅版,5.00,40.2,12L/100km,2019-02,本人2019年购买了19款的奥迪a6l. 最满意的地方就是这款车的外观，以前考虑了奥迪的a4l，但是空间比较小，还有就是乘坐奥迪a6l比较舒服。新款车型配备矩阵式大灯， 空间方面比老款大一些，之前还感觉这次改款之后后备箱变小了，用了一段时间感觉后备箱非常深。不错的空间非常够用。 动力方面采用高功率，2.0t涡轮增压发动机，起步的时候还是比较冲的，但是到后期感觉没有机械增压的好。 个人感觉方向盘还是比较轻便的，要比奥迪a4l重一些。而且转向比较精准，但是车身比较长，在市区内行驶，转弯半径比较大。 目前百公里，在市区内行驶的油耗在12升油，严重拥堵的路况更高
ycresets32369064,2019-05-23,奥迪A6L 2017款 30 FSI 技术版,4.00,43.8,,2017-05,"选择台车主要还是因为外观漂亮,动力十足。品牌大，能拿得出手。"
ycresets32722812,2019-05-10,奥迪A6L 2018款 35 TFSI 典藏版,5.00,41.7,,2018-03,"大品牌值得信赖，动力足,外观抢眼,安全系数高,舒适。"
子3730704,2019-05-06,奥迪A6L 2017款 TFSI 技术版,5.00,42.0,9L/100km,2017-08,买车主要参考品牌。外观必须帅气。开起来又舒服。好几个朋友都介绍奥迪。看来看去也是a6 :较适合。
ycresets33056729,2019-05-05,奥迪A6L 2017款 TFSI 舒适版,4.00,45.0,,2017-03,"外观大气,动力强劲,空间宽敞舒适。"
80后刘郎,2019-05-01,奥迪A6L 2017款 30 FSI 技术版,5.00,37.0,11L/100km,2017-08,【本人于2017年购买了2017款奥迪A6L技术型】 入手A6L后，朋友从早期叫我姓名到后期叫我四圈车，最后简称我为四圈。可见这个四个圈的品牌在国内的口碑和魅力还是 较富影响力。 #最不满意 品牌溢价偏重，价格偏高。（不满意和满意放在一起心理就平衡了） #最满意 都很满意，不限于外观、内饰、动力与品质，从面到点都做得较完善的一款车。 #外观 气场也是非常足，商务味浓，有人可能会说品牌衬托出气质，但我觉得即使把四个圈扣掉的话，它的外观设计绝 对也是高颜值。 #内饰 用料讲究，做工细节处理较好。中控伸缩屏设计较人性化，也显科技
98K突击,2019-04-16,奥迪A6L 2017款 30 FSI 技术版,4.00,38.0,11L/100km,2017-07,整车大气，做工样式奢华，舒适感好，档次感很高，品牌的价值体现身份
快如闪电雪梨3805,2019-04-15,奥迪A6L 2019款 45 TFSI quattro 臻选动感版,4.00,43.8,11.7L/100km,2019-03,之前一直在纠结奔驰e和新奥迪，最后还是选择了奥迪，a6的内饰和侧脸确实更吸引我。
晦迹韬光椰子3343,2019-04-15,奥迪A6L 2019款 45 TFSI quattro 臻选致雅版,5.00,47.88,10L/100km,2019-01,#最满意 最满意的地方就是新款奥迪A6L的这个中控了，我个人认为这个可是2019款的A6最大的卖点了，真的是非常的有科技感，也非常的帅。 #最不满意 不满意的地方就是新款的A6还是延用了EA888的第三代，虽然和二代的EA888相比，三代的发动机优势很大，但是还是避免不了后期烧机油的问题，我觉得虽然新车刚上市，但是6-7万公里以后烧机油估计是跑不了了。 #空间 新款A6的空间一如既往的优秀，虽然融入了很多年轻运动的元素，但是空间的表现没有打很大的折扣，当然后排的头部空间比起上一代略有缩小，但是不影晌。 #外观 这次的A6L外观也有了很大的改观，
ycresets32083222,2019-04-11,奥迪A6L 2017款 30 FSI 技术版,5.00,39.5,13L/100km,2018-03,性能好，空间足够大，外观漂亮，操控性强。
一直纵容你88,2019-04-06,奥迪A6L 2017款 45 TFSI quattro 运动版,4.00,48.0,9.5L/100km,2017-05,奥迪A6L车型非常的成熟，速度与舒适性还有操控上都很兼得，科技感非常强，整车的配置高，性价比我觉得很不错
ycresets28904816,2019-03-25,奥迪A6L 2019款 45 TFSI 臻选动感版,5.00,43.38,8.5L/100km,2019-03,"#内饰 全新的奥迪A6L的内饰就是我选择这个的车一大部分的理由确实是做出了很大的改变，整体风格可以说是科技感十足，开出去上哪都显得很高端可以说是买了台A6，顶替了一台A8,的商业价值，可能是新款跟a8太像了，走哪都有人说我去换A8啦，中控台三块大屏一看就显得很大方，（几乎是跟A8一模一样）看着就很喜欢！尤其是仪表全液晶显示时速表也是可变大变小切换，满满的科技感，内饰座椅是偏软的，我的是运动座椅，包裹性真的是超级好，摸上去质感很好类似于翻毛皮那种，很对的起这个价位。细节奥迪这方面不得不说处理很到位！ #空间 A6L的空间就不用多说了轴距就三米多，那么大的空"
Yangwiei,2019-03-25,奥迪A6L 2019款 45 TFSI 臻选致雅版,5.00,43.38,,2019-01,#最满意 #最满意 可以说是A6L的外观，我相信不少人看到A6L，都会被他的外观所震撼，【商务选雅致型，个人用建议选择运动型】雅致版可以说是成熟稳重，整体很有厚重感，造型很有风度！运动版可以说是静若处子，动若疯兔。我买的是标配雅致型，它的内饰风格我很喜欢，前大灯是矩阵灯，内饰设计是不得不夸突破科技启迪未来。 #外观 新款的A6L外观更加有时尚元素些，整体也是打破奥迪一贯的经典外观，变得更加成熟稳重，车头很有厚重感，车身5米多，很像领导座驾！大灯看起来很漂亮，车身线条流畅度高，做工很不错，19寸的轮毂很大很帅气，超大的全景天窗，看着就很舒服A6L的内饰做工
内敛的小鹿3666,2017-11-20,奥迪A6L 2018款 30周年纪念版 TFSI 进取版,5.00,40.6,8.8L/100km,2017-07,#油耗 油耗方面还算可以，车子提回来有几个月了，目前行驶三千多公里，主要都是在市区行驶，平均油耗8.8L，对于这个级别的车来说算是比较省油的。 #操控 对于这么庞大身躯的车子，操控方面自然比较稳当，不算很灵活。平常开车也不敢暴力驾驶。这车方向盘沉稳，指向性很明确。车子挂档还算顺畅，不会很卡顿。 #性价比 在BBA车型当中，奥迪车的性价比自然不用多说，都是大家公认好。虽然说A6L价位方面有点高，但是在了解它各方面性能之后，自然觉得这价位很值得。配置丰富，外观十分霸气，空间感不错，很值得拥有。 #动力 这车1.8T的动力对我来说很够用，平常主要是在市区行驶，
正文51,2017-10-14,奥迪A6L 2017款 TFSI 技术版,4.00,39.0,11L/100km,2017-09,#不满意 驾驶座座椅薄，短，窄，不够舒适，要是后排中间的凸起能改掉就更好了 #满意 外观大气，车灯漂亮，空间充裕，科技配置丰富，内饰豪华，动力还可以 #总评 看了沃尔沃s90，Q5，捷豹，路虎发现。沃尔沃车感觉有些傻大笨重的感觉，内饰科技感也没那么强，Q5马上更新还代了，除了全时四驱与不过时的外观，没有可选之处啊，捷豹对于我这么一个上班族来说，开着感觉总有那么点张扬，而且嫣红色的外观个人真是不喜欢，值得强调的是沃尔沃和捷豹的动力真的还不错。奔驰宝马性价比不高，最后争取了媳妇的意见，最终选择了品牌外观内饰等都看得过眼的A6L，皆大欢喜，全家都很喜欢，个人开
能言善道菠萝4438,2016-01-31,奥迪A6L 2014款 TFSI 标准型,5.00,39.1,9L/100km,2015-12,#油耗 出乎意料，综合9个油耗，家用经济 #动力 动力好，超车毫无压力，提速快 #性价比 性价比较高 #配置 功能还算不错，自己驾驶配置较全面的车了，配置科技感较强 #操控 换挡平顺，有推背感，无顿挫，指向精准，操控起来轻盈 #空间 储物空间不大，乘坐空间足够 #外观 外观不用说，绝对的低调豪华，信心多数人都喜欢 #舒适度 驾乘舒服度较高 #内饰 内饰没有想象中的那么完美，横向中控，加强了视觉延伸。 #总评 恭喜此帖荣登首页欢迎楼主下载“车友之家”App，分享您的爱车之道。更多精彩活动等着你！期待加入：http://club.yiche.com/创建属于
