用户名,评论日期,车型款式,评星,裸车价,油耗,购车时间,评价内容
盖世的桃酥2781,2024-04-29,奥迪A6L 2023款 改款 40 TFSI 豪华动感型,4.21,32.0,9L/100km,2023-11,💰购车经历： 我买车的主要要求就是能够提升面子，因为经常需要出去跟朋友聚会或是与客户见面，而原来的车子现在开的话感觉太掉面子了，所以不如放到家里当做备用车子，曾经对比了很多的车型，发现还是奥迪和宝马的车型比较漂亮，所以我决定仔细的对比一下在这两款车子当中选择一个，没事的时候我就到4s店去细致的对比，经过仔细的对比我觉得奥迪a6l这款车还是比较好的，很豪华的配置和比较大气的外观让我开出去的时候感觉非常舒服。 💴提车价格： 裸车32万、便宜了将近11W，商业保险6200元左右，购置税约28000左右，落地35.7W左右。送了几次基础保养以及贴膜、脚垫这些
龙腾虎跃SUV2758,2024-04-28,奥迪A6L 2023款 45 TFSI quattro 尊享动感型,4.43,41.2,9.6L/100km,2023-11,💲提车价格： 品牌：2023款奥迪A6L 45TFSI quattro尊享动感型 裸车：41.2万 购置税：3.7万元 交强险车船税：1370元 首次商业险：1.7万多 上牌费：500元 合计落地：8.14万 ✔️使用感受： 已经提车6个多月了，跑了9700万公里了，奥迪A6L操控起来非常出色。它搭载了2.0T发动机，动力强劲而平顺；同时悬挂系统也非常舒适，过坑洼路面时减震效果很好。方向盘轻重适中，转向精准且灵敏度高。车辆的刹车反应也很迅速，让我在行驶过程中更加安心和放心地享受旅程。 👍🏻最满意： 外观设计很年轻时尚，车身线条流畅且富有力量感。
所向无敌栗子2766,2024-04-28,奥迪A6L 2023款 改款 40 TFSI 豪华动感型,4.14,36.1,9.5L/100km,2023-11,提车费用明细: 奥迪A6L的优惠幅度挺大，综合优惠6W多，裸车价36.1W，购置税3万多点，保险6600左右，上牌费200元，全款落地40.15万左右。优惠完，感觉性价比还不错了！而且奥迪的服务确实不错，销售也很热情！ 🕙购车经历： 一直以来，我都有换车的打算。开始时，我在网上漫无目的地寻找车辆信息，每当经过4S店时，从奔腾E级到沃尔沃S90，再到奥迪A6L，都看了一遍，看到奥迪A6L有了想换车的冲动。对于奥迪A6L ，我是大爱，外观大气有范，看着比奔腾E级和沃尔沃S90更有味道，给人一种不一样的新鲜感。而且对比之下，它的车身避震效果更好，经过减速带时
小仙女0505,2024-04-24,奥迪A6L 2024款 45 TFSI 臻选动感型,4.64,34.0,10L/100km,2023-12,23年12月底提车到现在4个月，开了5000公里，想跟大家分享下这5000公里的用车感受。以下所述仅代表个人观点哦。 首先我购买的是45 甄选动感 两驱 2.0T发动机 245 匹的马力在家用来说的话动力上绝对够用，本身自身也属于新手司机，不追求弹射起步，推背感啥的，所以动力方面还是很满意的。而且时常坐一车人后备箱再拉点东西的时候起步超车也都很轻松 ，没有“肉”的感觉。并且我所在的地区下雨下雪都比较少，所以当时购买的时候最终也没有考虑上夸戳。车辆整体的空间很大，无论前排后排还是后备箱，这也是当初我第一眼相中的的原因。后排做180的男士也不会觉得伸展
优雅别致MPV2735,2024-04-21,奥迪A6L 2022款 45 TFSI 臻选致雅型,4.21,36.1,9.5L/100km,2023-05,🕙购车经历： 既然是买车，那就得选自己喜欢的牌子，再说了，我也是奥迪的粉丝。家里老爸一台Q5L，感觉很不错的，选择A6L的原因很简单，外观上符合我的需求，不会太过张扬，但又给人一种格调的感觉。来到4s店之后，也仔细地了解了一下，而且买的时候折扣非常地大，给我留下了深刻的印象。所以，在买之前就已经把价钱给搞定了，对自己预算。 提车费用明细： 价格方面我觉得还可以吧，优惠了7W左右，裸车36.1W加上购置税3.1W左右，还有商业险，5900，落地大概，40W。价钱确实优惠比较大，也符合我的预算。 🚗外观： 低调中带着一种高贵的气质，这就是我想要的，这套
学富五车灵猫2699,2024-04-24,奥迪A6L 2023款 40 TFSI 豪华动感型,4.57,36.7,9.2L/100km,2023-06,🌳购车经历: 我想每个男人都是很喜欢车的，我也不例外，从学生时代就开始关注各种车。那时候BBA对我来讲还是遥远的梦，还记得当时家里有个表哥开了一辆奥迪，太帅了，在我心里留下了深刻的印象。这些年家庭工作都逐渐稳定了，人到中年，还是会想起年轻时候的梦想，想着犒劳一下自己，奥迪还是我的首选。奥迪的车型，其实在预算内能选择的就那么几款，奥迪Q5L对我来讲太运动了，还是A6L更符合我现在这个年龄阶段，家用或商用都挺适合的，所以看车之后很快就定了奥迪A6L，当时买车价格也多少有点优惠，另外也送了全车贴膜，脚垫后备箱垫、行车记录仪、镀晶和免费首保，还算满意。 💲
画龙点睛软桃2776,2024-04-24,奥迪A6L 2023款 45 TFSI 臻选致雅型,4.43,39.6,11L/100km,2023-04,"🚘购车经历: 买车的时候前前后后看了两个月，bba几个品牌的车型都有试驾，对比下来还是喜欢奥迪A6L,城市代步来讲，这台车不管是操控还是空间表现都不错，试驾下来也能感受到奥迪的驾驶质感确实是很好的，驾驶平顺，动力表现也没什么不足，超车什么的都能给到我很好信心。当时买车比较急，价格也没便宜多少，就直接下定了，送了保养、太阳膜和脚垫这些东西。 💰费用详情： 品牌：2023款奥迪A6L 45 TFSI 臻选致雅型 裸车：39.6万 购置税：3.5万 交强险+车船税：1370元 首次商业险：1.4多 上牌费：500元 合计落地：44.7万 💗驾驶感受:"
雍容华贵朱雀2650,2024-04-24,奥迪A6L 2023款 45 TFSI 臻选动感型,4.21,38.7,8.9L/100km,2023-11,💰提车价钱： 奥迪A6L 45臻选动感，指导价为45.49万，优惠6.7W左右，裸车38.7W万元。购置税3.4W左右，交强险950元和商业保险6221元（三责100万赔付额度），上牌费500元，全款落地需要花费42.94W。 选装: 轮毂选择的是五双福铝合金轮毂，看着更高端一些。 然后加装了真皮座椅，2500，比混搭的要更显档次。 🕙购车经历： 我自己倒是没有把买车的预算定得太高，35~38万的样子，在老丈人的推荐下去看了一下红旗H9，这款车给我的感觉实在是太正派了，有些驾驭不了。不过顶配的凯迪拉克CT5刚好符合我的预算，只要34万就能够下地，但媳
开开心心菠萝2708,2024-04-24,奥迪A6L 2023款 40 TFSI 豪华动感型,4.14,36.1,8.9L/100km,2023-11,🕙购车经历： 当时选择奥迪a6的过程也挺坎坷，本来我是奔着宝马5系去的，和销售已经在线上谈好了，优惠8万，然后再送相应的赠品，但是到店以后却发现有各种套路，实在是搞得很恼火不买了，后来出去到了旁边的奥迪4S店，我对这款车并没有什么太深的概念，但是把这款车发到朋友群里以后，好多哥们都比较推荐我，了解一下这款车。在销售的推荐下，看了40动感，刚好又有现车。直降6.6W左右，很心动，回来又商量了一下，没啥问题，转天提车，优惠完裸车价36万左右，落地价格40W多点。保险大概6千多，购置税3.1万左右。也没别的大额支出，全款买的。 外观： 我觉得奥迪在外观设计方
晦迹韬光水仙2697,2024-04-23,奥迪A6L 2023款 改款 55 TFSI quattro 尊享动感型,4.29,49.9,10L/100km,2023-05,🕙购车经历： 其实在买这台车之前，我当时看中的车是宝马5。当时宝马5刚好迎来了换代，没啥趣味性了。奔驰E的话，没有优惠就算了，配置简配的比较严重，不想当奔驰的韭菜。最后思来想去，反正BBA都是一个档次的，虽然多少会有些差别，最后我还是决定买A6L高配，这款车的设计风格相对来说要稳重一些，不过我比较喜欢，不张扬，但是又不会过于低调。 💰提车价钱： 裸车49.9万，优惠5W多，税加保险缴纳了5.5W，全款落地55.4W左右。送5年10次保养，脚垫后备箱垫（后面自己加的）和隐藏式行车记录仪，销售态度不错，比较有耐心。 外观： 奥迪A6L的外观设计还是挺好看
所向披靡大象2749,2024-04-14,奥迪A6L 2023款 40 TFSI 豪华致雅型,4.36,34.7,9.3L/100km,2023-10,🚘购车经历: 奥迪是我一直都比较喜欢的品牌，只是对我们普通人来讲，大学刚刚毕业确实没有实力买这么贵的车。好在这些年我工作也挺努力的，经济能力也慢慢提高了，所以当初决定买车就第一时间考量奥迪这个品牌。我买的是奥迪A6L，价格在预算内，外观设计挺大气的，操控下来运动感满满，试驾的时候就能感受到，提供了出色的驾驶质感、养眼的外形和精致舒适的内部空间，不愧是我的梦中情车，虽然买下来价格稍微有点贵，不过能通过自己的努力入手梦中情车，我自己也是十分开心的。买车的时候4s店的工作人员服务也十分周到，从进店开始就十分热情，给我们倒茶，详细介绍车型，安排试驾，给我留下了
学富五车桑葚2677,2024-04-18,奥迪A6L 2023款 40 TFSI 豪华动感型,4.71,35.2,8.9L/100km,2023-05,🚘购车经历: 我之前开的是一台大众，各方面还是挺不错的，油耗也不高，而且底盘质感也很好。只是现在收入高了，就想换一辆更好的车开开，奥迪也是我一直比较青睐的一个品牌吧，所以当时换车就直接考虑奥迪。对我来讲奥迪A6L价格，空间，以及外观颜值都符合我的诉求，不过当时4S店没有现车，等了一周 左右才提车了。买车也送了脚垫，后备箱垫和两次保养， 挺不错的。 💰费用详情: 裸车：35.2万 购置税：当时购置3.1万元 车船税加交强险：1370元 首次商业险10600多 上牌费：500元 合计落地：39.5万 👍🏻驾驶感受: 驾驶操控感特别好，方向盘转向
盖世无双芒果2679,2024-04-16,奥迪A6L 2023款 45 TFSI 臻选动感型,4.64,36.8,9.4L/100km,2023-07,🚘购车经历: 身边有朋友在宝马4S店上班，所以当时买车首先考虑的其实是宝马， 在价格预算内看了宝马5系，但是我觉得宝马的车型商务氛围会更重一些，更适合年纪稍微大一点的人开吧。虽然我朋友说买车找他价格可能会优惠一点，但因为我个人实在不太喜欢宝马，最后还是没买。奥迪的车型给我的感觉会更精致优雅，也符合我这个年纪，而且新车也做了一些改进，在操控性能方面会有更好的体验，当然买车更重要的是看自己喜欢与否，我就根据自己的喜好买了奥迪A6L。当时买车的时候没上市多久，价格方面也没有太大的优惠，赠品也是一些比较基础的，有全车贴膜，首次免费保养，车内的脚垫，抱枕和行车记
浑然一体海豚2656,2024-04-15,奥迪A6L 2024款 40 TFSI 豪华动感型,4.57,35.94,9L/100km,2024-01,🚘【购车经历】 我买车的时候主要看重的就是动力和操控性能，我也挺喜欢开车的，所以就想开着能更爽更舒服一些。当时看了雷克萨斯，外形线条特别帅，也是我以前很喜欢的车型，但是开下来行驶品质达不到我想要的感觉。正好奥迪A6L出了新款，改款之后也有很大的进步，最重要的是开下来真的很爽，操控一绝。我在网上大概看了一下其他车友的入手价格，对比了几家4S店， 总算有一家达到了我的心理预估价格，而且马上能提车，就直接确定了下来。但是我买车优惠价格相对比较大，所以就没有多少赠品，只给了脚垫，首保和行车记录仪。 💰【费用详情】 裸车：35.94万 购置税：当时购置3.
卓越的冬,2024-03-27,奥迪A6L 2023款 改款 40 TFSI 豪华致雅型,4.43,34.7,9.5L/100km,2023-05,🚘购车经历： 奥迪A6L这款车整体还是比较均衡的，它比宝马5系和奔驰E要便宜了不少。整体的外形我是比较喜欢的，可能就是他符合我40多岁的年龄阶段吧，宝马5系的话太过于年轻，奔驰E好是好，但是价格确实高，我综合来看的话，奥迪A6L这款车还是性价比比较好的。经过自己的一番盘算，还是最终买了奥迪A6L。裸车34.7万，购置税3万多，车船税加交强险1370，商业险9135，落地38.6万。 ☑️最满意： 最满意的地方当然是外观和空间，外观方面我觉得比上一代好看太多了，特别是中网，感觉比以前更加的大气了。内部的空间也是非常宽敞，后排坐三个成年人也不会感觉到拥挤
崭新的轿跑2617,2024-04-05,奥迪A6L 2023款 45 TFSI 臻选动感型,4.29,39.0,9L/100km,2023-06,🚗购车经历： 父母年纪大了，我非常惦记，而他们也想要让我经常回家去看看，所以考虑着买一台燃油车车家里有纯电车上下班通勤还行，长途不行，所以想再买一台油车，这样短时间之内就不用换车了！ 我一直比较喜欢宝马5系和奥迪a6L，让我比较纠结的是这两台车子的性能和外观都挺不错的，但经过试驾以后我觉得还是奥迪a6L这车子更适合我，毕竟岁数也不小了喜欢更沉稳的车型。 💴提车价格： 买车的时候跟销售说厂家直降6W多，我买车的裸车价格是39W，除了买车的花费以外又交了3.4万元的购置税和950块的交强险，另外上牌费用和车船使用费一共900，商业保险花了8100元，另
神出鬼没金蟒2669,2024-04-03,奥迪A6L 2023款 45 TFSI 臻选动感型,4.21,39.1,9.8L/100km,2023-06,🚗购车经历： 作为一个90后，现在没有买车，真的是特别尴尬，每次回去同学聚会都会觉得不自在，其实也并不是钱不够，只是说驾照刚刚下来，开车有一些不敢，去年刚熟悉起来，所以也准备买车，看车的时候预算其实是做的比较充足的，想要在40万以内拿下一台适合自己有面子的车，我去试驾过宝马的3系，这款车辆的动力真的很充足，但是车子太过于年轻化，感觉对于我这种90后的人来说，有一些太张扬了。 又看了一下奥迪的a6l这款车辆，其实看过之后我是比较喜欢的车辆，整体非常简约大气，而且还是特别的有面子。 试驾的时候感受比较不错，运动感十足，而且这款车主要没有超预算，优惠力度大裸
学富五车珊瑚2663,2024-04-02,奥迪A6L 2024款 40 TFSI 豪华致雅型,4.50,35.94,9.4L/100km,2024-02,【购车经历】 一开始看的奥迪A6L、奔驰E级、宝马5系等，因为家里有个小宝宝需要一个空间大点的车。从网上了解到4S店看了两圈下来，A6L的试驾感受还是挺不错的，方向盘也比较灵活轻松，指向精准，刹车灵敏度也比较高，轻轻一踩就有反应了！底盘调教比较运动，很扎实也很稳当，转弯侧倾也不大。于是就订了豪华致雅版，裸车价35.94万，购置税3.2万，车险啥的花了2万不到，落地40多万了，送了贴膜，钥匙扣，脚垫。 【最满意】 最满意的就是A6L的外观，这个价位能买到这种气场的车已经很满足了。其次就是奥迪品牌的口碑一直很好，身边不少朋友都开的就是BBA车。 【不满意
雍容华贵青提2583,2024-03-29,奥迪A6L 2023款 45 TFSI 臻选动感型,4.21,36.39,9.4L/100km,2023-11,🚗购车经历： 其实对奥迪早就很喜欢了，年轻时候没啥钱，只能买个十来万的代步，现在36岁才开始圆了我20来岁的梦。 现在我已经成为了两个孩子的爸爸，也是这个家里的顶梁柱，日子逐渐步入正轨，手里还有多出来的预算，终于可以买到自己喜欢的车。同级别或者说是同价位的车型，从来就只考虑奥迪a6L，其实我更喜欢奥迪a7，但是手头预算不够，咱还得努力努力。奥迪A6这款车性价比确实比同级别车要好很多。 外观， 外观是我最满意的，整体的设计感非常的强烈。车身的线条也非常流畅自然。特别是车头部分的造型看起来非常有冲击力和辨识度，开出去也很有面子。内饰设计的非常时尚大气，用料
开门见山龙眼2545,2024-03-15,奥迪A6L 2024款 45 TFSI 臻选致雅型,4.14,36.4,8.6L/100km,2023-11,🚗购车经历： 今年是我和老公认识的第9个年头了，生活倒也是过得挺幸福，这一年也拥有了属于我们的第1台新车。起初和老公商量购买一台油电混合的车，因为我们不仅只适用于城市短途代步，偶尔还要跨城长途，如果是纯电动车，在续航方面还是让人有些焦虑的。 油电混合车型的选择，首先看了比较热门的理想ONE，车子的外观设计以及驾驶体验，还有后排的乘坐空间，都让人挺满意的。已经和老公开始商量着订车的计划了，但是最终还是放弃，因为插电混合动力的车型对于我们目前的居住环境来说，充电特别不方便。老小区连停车都是个问题，考虑到这一实际情况就放弃了。 这时又不得不重新计划选燃油
星驰的菠萝2491,2024-03-15,奥迪A6L 2024款 45 TFSI 臻选动感型,4.14,36.39,9L/100km,2024-01,🚗购车经历： 我30岁了，平生头一次买车还是在25岁的时候，买的是一台帕萨特。我们的家是经商的，平时要接客户，帕萨特这些年表现挺满意，但是现在已经有些力不从心了，加上车子用了好几年了有些配置也落伍了，就想要换车。 我选了一辆奥迪A6L，在同级中显得格外优秀。奥迪品牌和德系车都是我的最爱，开着奥迪A6L招待客户，是一件很拉风的事情。这款车的外形很符合我的口味，很有格调。我特意去了当地的4S店打听了一下价格，优惠力度都差不错，而且这家4S店送的礼物不错，最终就买了一辆。 💴提车价格： 买的是24款45臻选动感，指导价是45.49W， 优惠，9.1W，实际
美丽的灵猫1733,2023-10-31,奥迪A6L 2023款 改款 45 TFSI 臻选动感型,3.86,36.8,8L/100km,2023-09,🚗购车经历 在于老公相遇相识相知相爱的第九年，我们终于拥有了第一台车。起先最开始还在考虑油混一体的车，因为城市短途跟跨城长途，我们日常都有需要，所以一开始电车就被我们排除在外，同时也是考虑到第一台的问题。 油混车当时首选是理想ONE，车型、驾驶体验、驾驶空间都很不错，尤其试驾时候看到一辆浅蓝色的车，更爱了。后面没有选择理想的原因，是因为它是混动的，当下住的地方，充电还是很不方便，要开差不多十几分钟的车才到充电的地方，商量下都觉得太麻烦了。 油车里面，考虑的奥迪A6L跟凯迪拉克的CT6、还有个捷豹的一款。凯迪拉克C
平步青云飞鱼1054,2023-07-21,奥迪A6L 2021款 45 TFSI quattro 臻选动感型,4.07,38.0,,2021-11,🚗购车经历 跑遍了杭州所有的奥迪4S店，了解了各种价格，终于在滨江元通宾奥4S店下单了！砍价过程很刺激，讲究天时地利人和，我是快下班的时候过去，一直拖着他们讲价，然后拿其他家的价格谈，一直砍，最后他们在几个小时后，销售终于松口了，于是马上付了定金。 💰提车价格 奥迪A6L，45，4驱，臻选动感 全款，正常购买（非留学生、非关系户，纯属小老百姓，连大客户优惠都没用上） 总价：43.35w 其中包含： 裸车价+装潢：388200 税费：388200/11.3=34354 保费：1.1w 其他： 1、保养：除首保外再送2次保养，一共3次保养 2、赠送
木土不学土木,2023-07-19,奥迪A6L 2022款 45 TFSI quattro 臻选致雅型,4.57,39.8,10.8L/100km,2022-12,【购车时间】2022年12月 【版本】2022款45甄选四驱版本 【车价】落地45.8左右 【城市坐标】江苏南通 【目前使用里程】2.4万km 【购车经历】当时过年的时候就准备换车了，以前开的我爸的老车，还是得有一辆自己的车的。当时看了捷豹xfl有点走不动道了，外观内饰太优雅了，然后试驾了一下，很好，这调教，白瞎了硬件。然后转头去了奥迪，去了先问有没有四驱现车，然后谈价格，我也就跑了一家店，就直接定了，谈着价格合适就交了一万定金，但是车只有致雅了，后来想着真皮内饰也行。就忍了，第二天就把车提回去了。 【提车价格】反正保险啥的全部弄下来45.8万 当时
快乐的蓝莓0390,2023-06-21,奥迪A6L 2023款 改款 45 TFSI quattro 臻选动感型,4.57,38.0,9L/100km,2023-04,【购车经历】 工作了，😫出行去哪里都不是很方便，于是准备购置一辆车子代步。我们一开始的意向品牌是领克或者日系车，主要考虑的是性价比，预算在20万左右。因为我们有长途需求，电车不做首选。领克01各方面都比较满意，就是外观不是很舒展，我们纠结了很久。另一半觉得机氪001很香，😋符合我们大部分需求：空间大，省油，外观好看。正如上面所说我们有长途需求，😖😖纯电车实在是对我们很鸡肋。后来和父母父母商量后，我们选择了奥迪A6l，各方面都比较符合我们的需求，价格也相应上涨。💥我们最终选择的是A6L 45 夸戳 臻选动感。主要是考虑到跑长途，驾驶及乘坐舒适度。
Lee34516,2023-03-04,奥迪A6L 2023款 45 TFSI quattro 臻选动感型,4.79,39.15,14L/100km,2023-02,我是在长春做生意的，今年28，身边好多同龄人问我为什么要选奥迪A6L，不太像年轻人开的车，我没多解释，只说自己喜欢，但是等他们看到我的车后，都陷入了“真香定律”。 奥迪A6L是我的第二台车，第一台本田缤智我开了七年，因为做生意，“排面”很重要，要有商务气息，但不想选太张扬的车，所以奔驰E和宝马5系压根就没考虑过。刚开始打算换车的时候也纠结要选一台什么样的车，直到我在网上看到新款奥迪A6L的外观就深深爱上了。 到了4S店看了下实车，坐到车内看到木纹内饰，三块屏幕，让我决定选这台车准没错，先开始还纠结选动感还是致雅，看到动感的20
旭日东升ii,2023-03-02,奥迪A6L 2023款 45 TFSI 臻选动感型,4.64,38.0,12L/100km,2023-01,个人情况&购车经历 作为一个二十岁出头年纪的人，首先提到这款车型都会感觉年轻人开会显得不是很搭，但是目前事业处在机关单位，需要一款外观低调奢华程度适中的车，奥迪A6L是我的首选。同等价位车型还试驾了宝马5系，当时首先对比了两台车的车内空间，空间的话两台车相差不是很多，后来对比了驾驶的操控性以及车的性能方面，宝马5系油门踩起来感觉偏硬，所以综合起来还是奥迪方面更胜一筹，其次就是单纯觉得奥迪A6L的外观气场直接碾压，所以没有犹豫选择了这款车型。当时购买车款车的时候裸车价格38万，贷款后落地价格41万，购置税4万多，保险8000，选装了座椅加热，20寸轮毂，桃
雍容华贵蘑菇3628,2022-07-18,奥迪A6L 2021款 45 TFSI 臻选动感型,4.43,41.2,9.5L/100km,2021-05,【购车经历】年龄不小了，一直开老爸的车子，虽然老爸车子多，但是最近感觉车子都不是很适合我，而且感觉也希望有个属于自己的车子了，其实上之前选车的时候跟本没有考虑过A6L，反正从我的印象里就是认为A6L太老气，甚至都没有考虑过奥迪，因为除了三联屏内饰，奥迪的其他内饰设计真的不太符合我的审美。所以最开始看的是新4系，因为觉得外观够酷够帅够年轻，倒没怎么研究车的综合情况，价钱的话在预算范围内就好。但后来去宝马4S店了解了一下，新4系压根就没车，等车周期动则四个月到半年，所以pass。又看了五系和老款四系，宝马略显圆润的外观越看越觉得不喜欢。后来出门拐了个弯儿就顺
ycresets37408554,2022-07-02,奥迪A6L 2020款 40 TFSI 豪华动感版,4.43,36.0,9.8L/100km,2020-08,【购车经历】今年22岁，老家是安徽的，目前在河南工作。20年8月27日提车，人生第一辆车。 买这车也不算是代步，因为在市里面也不怎么需要车，一家人回老家方便，主要还是为了以后结婚用。 买A6L就从冲着：三联屏+飞机档把， 奥迪叫：虚拟座舱。中控是斜向驾驶员的，整体成环绕式。 液晶仪表能显示地图，有3D丶卫星，2d三种模式。对于我这种路盲，在市区开车，可以从容不迫了。 当时只试驾了A6L和Q5L两款车。q5L内饰硬塑料多，买的是A6L40tfsi，动感型。 裸车价36万，购置税3万，保险是1万4（中华保险）。落地40万（全款），比我老家那边差不多当时就在
